{
  "apiVersion": "terrascale.io/orchestrator/v1",
  "id": "workload-api",
  "generation": 2,
  "resourceVersion": 9,
  "ownership": {
    "kind": "RegionalController",
    "authorityId": "gru-controller"
  },
  "creationActor": {
    "kind": "GitOps",
    "actorId": "release-controller"
  },
  "auditCorrelationId": "reconcile-12345678"
}
